dataset,source,snapshot_id,source_row_id,raw_source_token,reason_codes,raw_excerpt,move_id,character_slug,move_name,input,move_group,table_index,binding_class,publish_eligible,confirmation_status,candidate_move_ids,collision_group,conflicting_move_ids
supercombo_enrichment,supercombo,20260412T212932Z-447e18a5,20260412T212932Z-447e18a5:t053:akuma_j214k,akuma_j214k,supercombo_binding_excluded,"{""binding_class"":""G"",""input"":""j.214K"",""move_group"":""aerial_tatsumaki_zanku_kyaku"",""move_name"":""Aerial Tatsumaki Zanku-Kyaku"",""notes_sc"":""During forward jump only; can hit cross-up but does not hit overhead; puts opponent into limited juggle state; KD and block advantage depends on how high it connects; 4f less blockstun on cross-up version; Akuma is in a crouching state on frames 4-16 of landing recovery; lower foot/leg hurtbox is projectile invuln 1f~land"",""punish_adv"":""KD +46(+52)"",""raw_source_token"":""akuma_j214k""}",,gouki_akuma,Aerial Tatsumaki Zanku-Kyaku,j.214K,aerial_tatsumaki_zanku_kyaku,53,G,False,not_required,,,
supercombo_enrichment,supercombo,20260412T212932Z-447e18a5,20260412T212932Z-447e18a5:t054:akuma_j214kk,akuma_j214kk,supercombo_binding_excluded,"{""binding_class"":""G"",""input"":""j.214KK"",""move_group"":""aerial_tatsumaki_zanku_kyaku"",""move_name"":""Aerial Tatsumaki Zanku-Kyaku"",""notes_sc"":""During forward jump only; cannot hit cross-up or against grounded opponents; stops Akuma's jump momentum; performs final kick on hit only, which slams opponent down into a limited juggle OTG state (combos into 623LP/MP/PP on lower connect, but more lenient after high connect like j.MP > j.214KK); KD advantage depends on how high it connects; Akuma is in a crouching state on frames 4-16 of landing recovery; lower foot/leg hurtbox is projectile invuln 1f~land"",""punish_adv"":""KD +40(+53)"",""raw_source_token"":""akuma_j214kk""}",,gouki_akuma,Aerial Tatsumaki Zanku-Kyaku,j.214KK,aerial_tatsumaki_zanku_kyaku,54,G,False,not_required,,,
supercombo_enrichment,supercombo,20260412T212932Z-447e18a5,20260412T212932Z-447e18a5:t084:akuma_j214pp,akuma_j214pp,supercombo_binding_excluded,"{""binding_class"":""G"",""input"":""j.214PP"",""move_group"":""double_zanku_hadoken"",""move_name"":""Double Zanku Hadoken"",""notes_sc"":""Shin Akuma only (Back Taunt~Down Taunt); forward Jump only on airborne frame 9-33; throws 2 consecutive 1-hit fireballs (2nd fireball travels faster and farther); dissipates if Akuma is hit; fireballs travel downward at ~45 degree angle; on hit only, landing recovery after 2f is cancelable into any action except walking/jumping; projectile hitbox is considered an airborne attack (can be avoided with anti-air invuln moves); puts airborne opponents into free juggle state (or maintains existing juggle state); advantage varies significantly depending on timing/spacing/angle (at worst, approximately +5 oB vs. tall characters, +7 oB vs. standard characters, and unsafe on Perfect Parry; always enough hit advantage to link); foot hurtbox is projectile invuln 1f~land; upper half of hitbox only connects on opponents mid-combo"",""punish_adv"":""varies"",""raw_source_token"":""akuma_j214pp""}",,gouki_akuma,Double Zanku Hadoken,j.214PP,double_zanku_hadoken,84,G,False,not_required,,,
supercombo_enrichment,supercombo,20260412T212932Z-447e18a5,20260412T212932Z-447e18a5:t079:akuma_j236236k,akuma_j236236k,supercombo_binding_excluded,"{""binding_class"":""G"",""input"":""j.236236K"",""move_group"":""super_arts"",""move_name"":""Tenma Gozanku"",""notes_sc"":""5-hit Super projectile; during Forward or Neutral Jump only; 10f extra landing recovery on block/whiff; KD advantage varies significantly depending on angle and distance from opponent; puts airborne opponents into limited juggle state; travels down at ~45 degree angle; projectile speed/angle is not affected by button strength; projectile hitbox is considered an airborne attack (can be avoided with anti-air invuln moves); dissipates if Akuma is hit; can be used while OD projectiles are on-screen; leg hurtbox is projectile invuln until landing; crouching state on final recovery frame"",""punish_adv"":""KD +49~"",""raw_source_token"":""akuma_j236236k""}",,gouki_akuma,Tenma Gozanku,j.236236K,super_arts,79,G,False,not_required,,,
supercombo_enrichment,supercombo,20260412T212932Z-447e18a5,20260412T212932Z-447e18a5:t043:akuma_j236p,akuma_j236p,supercombo_binding_excluded,"{""binding_class"":""G"",""input"":""j.236P"",""move_group"":""zanku_hadoken"",""move_name"":""Zanku Hadoken"",""notes_sc"":""Forward Jump only on airborne frame 9-33; 1-hit projectile; dissipates if Akuma is hit; button strength determines fireball trajectory (LP ~35 degrees / MP ~45 degrees, HP ~50 degrees); on hit only, landing recovery after 2f is cancelable into any action except walking/jumping; projectile hitbox is considered an airborne attack (can be avoided with anti-air invuln moves); puts airborne opponents into free juggle state (or maintains existing juggle state); advantage varies significantly depending on timing/spacing/angle (at worst, approximately -5 oB vs. tall characters, -3 oB vs. standard characters, and unsafe on Perfect Parry; always enough hit advantage to link); foot hurtbox is projectile invuln 1f~land; upper half of hitbox only connects on opponents mid-combo"",""punish_adv"":""varies"",""raw_source_token"":""akuma_j236p""}",,gouki_akuma,Zanku Hadoken,j.236P,zanku_hadoken,43,G,False,not_required,,,
supercombo_enrichment,supercombo,20260412T212932Z-447e18a5,20260412T212932Z-447e18a5:t044:akuma_j236pp,akuma_j236pp,supercombo_binding_excluded,"{""binding_class"":""G"",""input"":""j.236PP"",""move_group"":""zanku_hadoken"",""move_name"":""Zanku Hadoken"",""notes_sc"":""Forward/Neutral Jump only on airborne frame 9-33; 3-hit OD projectile; dissipates if Akuma is hit; creates stationary projectile on frames 6-20, then shoots downward at ~50 degree angle (this projectile will only have 2 hits if the initial hitbox collided with opponent); on hit only, landing recovery after 2f is cancelable into any action except walking/jumping; projectile hitbox is considered an airborne attack (can be avoided with anti-air invuln moves); puts airborne opponents into free juggle state (or maintains existing juggle state); puts grounded opponents into limited juggle state; advantage varies significantly depending on timing/spacing/angle (at worst, approximately -3 oB vs. tall characters, -1 oB vs. standard characters, but +1~3 if all hits Perfect Parried); foot hurtbox is projectile invuln 1f~land; upper half of hitbox only connects on opponents mid-combo"",""punish_adv"":""KD~"",""raw_source_token"":""akuma_j236pp""}",,gouki_akuma,Zanku Hadoken,j.236PP,zanku_hadoken,44,G,False,not_required,,,
supercombo_enrichment,supercombo,20260412T212932Z-447e18a5,20260412T212932Z-447e18a5:t023:akuma_j2mk,akuma_j2mk,supercombo_binding_excluded,"{""binding_class"":""G"",""input"":""j.2MK"",""move_group"":""normals"",""move_name"":""Tenmaku Blade Kick"",""notes_sc"":""Forward Jump only; 6f extra landing recovery on whiff; great tool for mixing up jump timings, especially against characters that rely on non-invincible anti-airs; much stronger hurtbox compared to other divekicks; cannot hit cross-up; all landing recovery after the first 2 frames has a crouch-sized hurtbox, and the final recovery frame is in a crouching state; kicking leg is projectile invuln on frame 14 until landing"",""punish_adv"":""+5(+15)"",""raw_source_token"":""akuma_j2mk""}",,gouki_akuma,Tenmaku Blade Kick,j.2MK,normals,23,G,False,not_required,,,
supercombo_enrichment,supercombo,20260412T212932Z-447e18a5,20260412T212932Z-447e18a5:t014:akuma_jmp,akuma_jmp,supercombo_binding_collision,"{""binding_class"":""E"",""input"":""j.MP"",""move_group"":""normals"",""move_name"":""Jumping Medium Punch"",""notes_sc"":""Puts airborne opponents into limited juggle state but no juggle potential on its own; lenient cancel window to juggle into j.214K/j.236P/Air SA1; lower body projectile invuln 8-23f (cannot be used to avoid the 2nd hit of JP's OD Amnesia bombs)"",""punish_adv"":""+13(+15)"",""raw_source_token"":""akuma_jmp""}",,gouki_akuma,Jumping Medium Punch,j.MP,normals,14,E,False,not_required,,gouki_j_mp_followup,gouki_akuma_015_j_mp
supercombo_enrichment,supercombo,20260412T212932Z-447e18a5,20260412T212932Z-447e18a5:t033:akuma_mpmk,akuma_mpmk,supercombo_binding_one_to_many,"{""binding_class"":""D"",""input"":""MPMK"",""move_group"":""system"",""move_name"":""Drive Parry"",""notes_sc"":""See Drive Parry . Perfect Parrying has only 1F of recovery and disables the opponent from canceling their attack. Perfect Parrying projectiles puts you into fixed 11 frames of recovery. After a Perfect Parry, all Super Gauge gain is reduced by 20% and Drive Gauge gain/damage is reduced by 50% for the entire punish combo."",""punish_adv"":""-"",""raw_source_token"":""akuma_mpmk""}",,gouki_akuma,Drive Parry,MPMK,system,33,D,False,not_required,gouki_akuma_073_lplk | gouki_akuma_080_5_6_lplk | gouki_akuma_084_hphk | gouki_akuma_087_mpmk | gouki_akuma_088_mpmk | gouki_akuma_089_mpmk,,
