dataset,source,snapshot_id,source_row_id,raw_source_token,reason_codes,raw_excerpt,move_id,character_slug,move_name,input,move_group,table_index,binding_class,publish_eligible,confirmation_status,candidate_move_ids,collision_group,conflicting_move_ids
supercombo_enrichment,supercombo,20260412T212323Z-09d0c791,20260412T212323Z-09d0c791:t021:a.k.i._6hk,a.k.i._6hk,supercombo_missing_official_safe_row,"{""binding_class"":""A"",""input"":""6HK"",""move_group"":""command_normals"",""move_name"":""Qiu Niu"",""notes_sc"":""8f extra recovery on whiff; Low Crush 11-26f (not airborne); 1st hit puts airborne opponents into limited juggle state (2nd hit causes air reset); excellent pressure tool, especially using Drive Rush forward momentum; Counter-hit/Punish Counter bonus advantage carries through both hits"",""punish_adv"":""+8"",""raw_source_token"":""a.k.i._6hk""}",aki_021_6_hk,aki,Qiu Niu,6HK,command_normals,21,A,True,not_required,,,
supercombo_enrichment,supercombo,20260412T212323Z-09d0c791,20260412T212323Z-09d0c791:t040:a.k.i._214hp,a.k.i._214hp,supercombo_missing_official_safe_row,"{""binding_class"":""A"",""input"":""214HP"",""move_group"":""specials"",""move_name"":""Toxic Wreath"",""notes_sc"":""Strike hitbox (no projectile durability); poisons opponent on hit; puts opponent into limited juggle state; extended arm is projectile invincible 13-21f; useful combo and juggle tool; relatively safe blockstring ender, but can whiff in cancels outside close range; can get significantly better frame advantage on a late meaty connect (up to +4 on block); leaves a 2f blockstring gap when canceled from 5LK, or a 4f gap (trade combo) when canceled from 2LP; 6f hitconfirm window into SA3 refers to 2nd hit only"",""punish_adv"":""KD +40"",""raw_source_token"":""a.k.i._214hp""}",aki_032_2_1_4_hp,aki,Toxic Wreath,214HP,specials,40,A,True,not_required,,,
supercombo_enrichment,supercombo,20260412T212323Z-09d0c791,20260412T212323Z-09d0c791:t045:a.k.i._214lk,a.k.i._214lk,supercombo_missing_official_safe_row,"{""binding_class"":""A"",""input"":""214LK"",""move_group"":""specials"",""move_name"":""Cruel Fate"",""notes_sc"":""Shortest trajectory; cannot hit cross-up; Counter-hit/Punish Counter bonus advantage applies to all hits; landing recovery has a crouch-sized hurtbox despite being in a standing state; first 2 hits will whiff on crouching opponents (less damage, chip, Drive Dmg)"",""punish_adv"":""+5 (KD +38~45)"",""raw_source_token"":""a.k.i._214lk""}",aki_037_2_1_4_lk,aki,Cruel Fate,214LK,specials,45,A,True,not_required,,,
supercombo_enrichment,supercombo,20260412T212323Z-09d0c791,20260412T212323Z-09d0c791:t046:a.k.i._214mk,a.k.i._214mk,supercombo_missing_official_safe_row,"{""binding_class"":""A"",""input"":""214MK"",""move_group"":""specials"",""move_name"":""Cruel Fate"",""notes_sc"":""Medium trajectory; cannot hit cross-up; Counter-hit/Punish Counter bonus advantage applies to all hits; landing recovery has a crouch-sized hurtbox despite being in a standing state; first 2 hits will whiff on crouching opponents (less damage, chip, Drive Dmg)"",""punish_adv"":""+7 (KD +38~45)"",""raw_source_token"":""a.k.i._214mk""}",aki_038_2_1_4_mk,aki,Cruel Fate,214MK,specials,46,A,True,not_required,,,
supercombo_enrichment,supercombo,20260412T212323Z-09d0c791,20260412T212323Z-09d0c791:t047:a.k.i._214hk,a.k.i._214hk,supercombo_missing_official_safe_row,"{""binding_class"":""A"",""input"":""214HK"",""move_group"":""specials"",""move_name"":""Cruel Fate"",""notes_sc"":""Farthest trajectory; cannot hit cross-up; Counter-hit/Punish Counter bonus advantage applies to all hits; landing recovery has a crouch-sized hurtbox despite being in a standing state; first 2 hits will whiff on crouching opponents (less damage, chip, Drive Dmg); can link naturally into 2LP for a follow-up combo; pushback on block keeps A.K.I. out of throw range but also weakens her Burnout pressure"",""punish_adv"":""+8 (KD +41~50)"",""raw_source_token"":""a.k.i._214hk""}",aki_039_2_1_4_hk,aki,Cruel Fate,214HK,specials,47,A,True,not_required,,,
supercombo_enrichment,supercombo,20260412T212323Z-09d0c791,20260412T212323Z-09d0c791:t048:a.k.i._214kk,a.k.i._214kk,supercombo_missing_official_safe_row,"{""binding_class"":""A"",""input"":""214KK"",""move_group"":""specials"",""move_name"":""Cruel Fate"",""notes_sc"":""Hold left/right to steer trajectory; cannot hit cross-up; Counter-hit/Punish Counter bonus advantage applies to all hits on non-cinematic version; landing recovery has a crouch-sized hurtbox despite being in a standing state; goes into grab animation on a grounded hit for full damage and follow-up oki, but 3rd/4th hits can get a non-cinematic hit late in the active frames (400~640 damage); poisons opponent on hit (cinematic or non-cinematic); puts airborne opponents into a limited juggle OTG state (KD +51~58); Super cancel works only on non-cinematic version; SA2 cancel will not combo unless LP version lands as a counter-hit or Punish Counter"",""punish_adv"":""HKD +42 (+6~7)"",""raw_source_token"":""a.k.i._214kk""}",aki_040_2_1_4_k_k,aki,Cruel Fate,214KK,specials,48,A,True,not_required,,,
supercombo_enrichment,supercombo,20260412T212323Z-09d0c791,20260412T212323Z-09d0c791:t051:a.k.i._236hk,a.k.i._236hk,supercombo_missing_official_safe_row,"{""binding_class"":""A"",""input"":""236HK"",""move_group"":""specials"",""move_name"":""Snake Step"",""notes_sc"":""Can switch sides with opponent (cross-up version usually has a fixed 23f recovery after passing through; total time depends on distance from opponent); at a very specific spacing, A.K.I. can cross-up with 43f move duration (extremely ambiguous left/right mixup); counter-hit state for entire move duration; projectile invincibility lasts longer on cross-up version; semi-low profile 11-17f (crouch height); crouching state 17f until end of recovery; low profile 18f until end of recovery; collision box disappears 20-31f to allow cross-up; Distance: 3.18 (3.84 cross-up)"",""punish_adv"":""-"",""raw_source_token"":""a.k.i._236hk""}",aki_043_2_3_6_hk,aki,Snake Step,236HK,specials,51,A,True,not_required,,,
supercombo_enrichment,supercombo,20260412T212323Z-09d0c791,20260412T212323Z-09d0c791:t052:a.k.i._236kk,a.k.i._236kk,supercombo_missing_official_safe_row,"{""binding_class"":""A"",""input"":""236KK"",""move_group"":""specials"",""move_name"":""Snake Step"",""notes_sc"":""Entire animation is vulnerable to Punish Counter Throws; crouching state 17f until end of recovery; Same-side version: 42f total animation, 8 recovery frames at the end that are vulnerable to strikes; Cross-up version: the entire animation is strike/projectile invincible; total duration of cross-up version depends on distance from opponent (23f fixed recovery time after passing through); collision box disappears 7-33f to allow cross-up; Distance: 4.06 (3.52 cross-up)"",""punish_adv"":""-"",""raw_source_token"":""a.k.i._236kk""}",aki_044_2_3_6_k_k,aki,Snake Step,236KK,specials,52,A,True,not_required,,,
supercombo_enrichment,supercombo,20260412T212323Z-09d0c791,20260412T212323Z-09d0c791:t056:a.k.i._2pp_k,a.k.i._2pp_k,supercombo_missing_official_safe_row,"{""binding_class"":""A"",""input"":""2PP~K"",""move_group"":""specials"",""move_name"":""Heel Strike"",""notes_sc"":""During Sinister Slide; 3f extra recovery on whiff; low profile 1-15f, semi-low profile 16-27f, crouch-sized hurtbox 28-35f; Counter-hit/Punish Counter bonus advantage carries through both hits; good combo tool that is also safe on block; both hits put airborne opponent into limited juggle state; 15f hitconfirm window into SA3 refers to 2nd hit only"",""punish_adv"":""+8"",""raw_source_token"":""a.k.i._2pp_k""}",aki_047_k,aki,Heel Strike,2PP~K,specials,56,A,True,not_required,,,
supercombo_enrichment,supercombo,20260412T212323Z-09d0c791,20260412T212323Z-09d0c791:t036:a.k.i._214lp_6p_burst,a.k.i._214lp_6p_burst,supercombo_binding_one_to_many,"{""binding_class"":""D"",""input"":""214LP~6P"",""move_group"":""nightshade_chaser"",""move_name"":""Nightshade Chaser (Burst)"",""notes_sc"":""Poisons opponent on hit; striking the bubble projectile before it makes contact with the opponent causes it to burst, dealing more damage; the burst itself is a large stationary 1-hit projectile hitbox with 6 active frames"",""punish_adv"":""KD +42"",""raw_source_token"":""a.k.i._214lp_6p_burst""}",,aki,Nightshade Chaser (Burst),214LP~6P,nightshade_chaser,36,D,False,not_required,aki_026_6_p | aki_028_6_p,,
supercombo_enrichment,supercombo,20260412T212323Z-09d0c791,20260412T212323Z-09d0c791:t038:a.k.i._214pp_6p_burst,a.k.i._214pp_6p_burst,supercombo_binding_one_to_many,"{""binding_class"":""D"",""input"":""214PP~6P"",""move_group"":""nightshade_chaser"",""move_name"":""Nightshade Chaser (Burst)"",""notes_sc"":""Poisons opponent on hit; striking the bubble projectile before it makes contact with the opponent causes it to burst, dealing more damage; the burst itself is a large stationary 2-hit OD projectile hitbox; damage/chip/KD Advantage are changed if only 1 hit of the detonation connects on opponent (this can happen when detonating from max range, or immediately after the first hit of 214PP connects); opponent is launched higher on hit, allowing follow-up juggles (much more juggle potential if only the 1 hit of 214PP Burst connects)"",""punish_adv"":""KD +43(+57)"",""raw_source_token"":""a.k.i._214pp_6p_burst""}",,aki,Nightshade Chaser (Burst),214PP~6P,nightshade_chaser,38,D,False,not_required,aki_026_6_p | aki_028_6_p,,
supercombo_enrichment,supercombo,20260412T212323Z-09d0c791,20260412T212323Z-09d0c791:t053:a.k.i._2pp,a.k.i._2pp,supercombo_binding_collision,"{""binding_class"":""E"",""input"":""2PP"",""move_group"":""sinister_slide"",""move_name"":""Sinister Slide"",""notes_sc"":""Semi-low profile 10-15f (crouch height); low profile 16-197f; Cancelable into follow-ups after 11f; can input up to exit stance after 28f (stance exit takes 21f on its own); automatically exits stance after 216f if no input is made (no low profile or projectile invincibility)"",""punish_adv"":""-"",""raw_source_token"":""a.k.i._2pp""}",,aki,Sinister Slide,2PP,sinister_slide,53,E,False,not_required,,aki_p_p_followup,aki_045_2_p_p
supercombo_enrichment,supercombo,20260412T212323Z-09d0c791,20260412T212323Z-09d0c791:t054:a.k.i._2pp_8,a.k.i._2pp_8,supercombo_binding_collision,"{""binding_class"":""E"",""input"":""2PP~8"",""move_group"":""sinister_slide"",""move_name"":""Sinister Slide Exit"",""notes_sc"":""Can be input after 28f of Sinister Slide; maintains low profile 1-10f and semi-low profile 11-21f (crouch height); fastest total Stance + Exit time is 49f; shortest Slide~Exit travel distance: 0.78"",""punish_adv"":""-"",""raw_source_token"":""a.k.i._2pp_8""}",,aki,Sinister Slide Exit,2PP~8,sinister_slide,54,E,False,not_required,,aki_p_p_followup,aki_045_2_p_p
supercombo_enrichment,supercombo,20260412T212323Z-09d0c791,20260412T212323Z-09d0c791:t057:a.k.i._2pp_lplk,a.k.i._2pp_lplk,supercombo_binding_collision,"{""binding_class"":""E"",""input"":""2PP~LPLK"",""move_group"":""entrapment"",""move_name"":""Entrapment"",""notes_sc"":""During Sinister Slide; () refer to Punish Counter damage; good range but slow startup"",""punish_adv"":""HKD +16"",""raw_source_token"":""a.k.i._2pp_lplk""}",,aki,Entrapment,2PP~LPLK,entrapment,57,E,False,not_required,,aki_048_lplk_followup,aki_048_lplk
supercombo_enrichment,supercombo,20260412T212323Z-09d0c791,20260412T212323Z-09d0c791:t064:a.k.i._4pppkkk,a.k.i._4pppkkk,supercombo_binding_excluded,"{""binding_class"":""G"",""input"":""4PPPKKK"",""move_group"":""taunts"",""move_name"":""Back Taunt"",""notes_sc"":""\""Isn't he wonderful? Ahhh~\""; \""Ugh, you're a trifling little pest.\"" bubbles have a large projectile hitbox behind A.K.I.; if popped, A.K.I. says a second line and enters a different recovery animation; puts opponent into limited juggle state"",""punish_adv"":""KD -197"",""raw_source_token"":""a.k.i._4pppkkk""}",,aki,Back Taunt,4PPPKKK,taunts,64,G,False,not_required,,,
supercombo_enrichment,supercombo,20260412T212323Z-09d0c791,20260412T212323Z-09d0c791:t062:a.k.i._5pppkkk,a.k.i._5pppkkk,supercombo_binding_excluded,"{""binding_class"":""G"",""input"":""5PPPKKK"",""move_group"":""taunts"",""move_name"":""Neutral Taunt"",""notes_sc"":""\""The master's prized poison... ahh, a perfect, beautiful, most brilliantly crafted poison! Now you'll get a taste.\""; builds 1 bar of Super gauge after 411f (1000 Super gauge on frames 303, 324, 346, 363, 383, then 5000 Super gauge on frame 411)"",""punish_adv"":""-"",""raw_source_token"":""a.k.i._5pppkkk""}",,aki,Neutral Taunt,5PPPKKK,taunts,62,G,False,not_required,,,
supercombo_enrichment,supercombo,20260412T212323Z-09d0c791,20260412T212323Z-09d0c791:t063:a.k.i._6pppkkk,a.k.i._6pppkkk,supercombo_binding_excluded,"{""binding_class"":""G"",""input"":""6PPPKKK"",""move_group"":""taunts"",""move_name"":""Forward Taunt"",""notes_sc"":""\""Time for some experimentation... I bet poison would work wonders on you.\"""",""punish_adv"":""-"",""raw_source_token"":""a.k.i._6pppkkk""}",,aki,Forward Taunt,6PPPKKK,taunts,63,G,False,not_required,,,
supercombo_enrichment,supercombo,20260412T212323Z-09d0c791,20260412T212323Z-09d0c791:t022:a.k.i._j2hp,a.k.i._j2hp,supercombo_binding_excluded,"{""binding_class"":""G"",""input"":""j.2HP"",""move_group"":""normals"",""move_name"":""Gong Fu"",""notes_sc"":""During forward jump only; can only hit as a cross-up; causes spike knockdown vs. airborne opponents; lower body projectile invuln 9-23f except around attack hitbox (cannot be used to avoid the 2nd hit of JP's OD Amnesia bombs)"",""punish_adv"":""+9(+19)"",""raw_source_token"":""a.k.i._j2hp""}",,aki,Gong Fu,j.2HP,normals,22,G,False,not_required,,,
supercombo_enrichment,supercombo,20260412T212323Z-09d0c791,20260412T212323Z-09d0c791:t025:a.k.i._lplk,a.k.i._lplk,supercombo_binding_collision,"{""binding_class"":""E"",""input"":""LPLK"",""move_group"":""throws"",""move_name"":""Whisper"",""notes_sc"":""Can walk 16-17f for a corner throw loop (strict timing to beat 4f normals); 1f more lenient vs. Marisa and 2f more lenient vs. Blanka/E.Honda/Zangief; a successful Throw Escape builds 1 Drive bar and 1000 Super gauge (10% bar); Throw Escape is awarded to a random player if input simultaneously"",""punish_adv"":""HKD +19"",""raw_source_token"":""a.k.i._lplk""}",,aki,Whisper,LPLK,throws,25,E,False,not_required,,aki_048_lplk_followup,aki_048_lplk
supercombo_enrichment,supercombo,20260412T212323Z-09d0c791,20260412T212323Z-09d0c791:t030:a.k.i._mpmk,a.k.i._mpmk,supercombo_binding_one_to_many,"{""binding_class"":""D"",""input"":""MPMK"",""move_group"":""system"",""move_name"":""Drive Parry"",""notes_sc"":""See Drive Parry . Perfect Parrying has only 1F of recovery and disables the opponent from canceling their attack. Perfect Parrying projectiles puts you into fixed 11 frames of recovery. After a Perfect Parry, all Super Gauge gain is reduced by 20% and Drive Gauge gain/damage is reduced by 50% for the entire punish combo."",""punish_adv"":""-"",""raw_source_token"":""a.k.i._mpmk""}",,aki,Drive Parry,MPMK,system,30,D,False,not_required,aki_048_lplk | aki_053_5_6_lplk | aki_057_hphk | aki_060_mpmk | aki_061_mpmk | aki_062_mpmk,,
